Primary Topic Id,,
name,count,
Neurobiological Mechanisms of Placebo and Nocebo Effects,28,
Global Burden of Chronic Pain,20,
Diagnosis and Management of Fibromyalgia Syndrome,6,
Anterior Cruciate Ligament Injuries in Athletes,4,
Artificial Intelligence in Medicine,4,
The Delphi Method in Research and Consensus Building,4,
Impact of COVID-19 on Mental Health,3,
Shoulder Pathology and Treatment Outcomes,3,
Management and Treatment of Peripheral Arterial Disease,3,
Transformation of Medical Education and Professionalism,2,
Spine Surgery Techniques and Technologies,2,
Health Economics and Quality of Life Assessment,2,
Development of Expert Performance in Sports Psychology,2,
Biomechanics of Running-Related Injuries,2,
Epidemiology of Sports-Related Musculoskeletal Injuries,2,
Embodied Cognition and Social Interaction,2,
Workplace Bullying and Harassment in Professional Environments,2,
Epidemiology and Prevention of Cardiovascular Diseases in Russia,2,
Sarcoma Research and Treatment,1,
Effects of Physical Activity on Health Outcomes,1,
Ankle Injuries and Disorders in Sports Medicine,1,
Cerebellar Contributions to Neurological Disorders and Functions,1,
Global Cancer Incidence and Mortality Patterns,1,
Projections and Outcomes of Arthroplasty Surgery in the US,1,
Effects of Brain Stimulation on Motor Cortex,1,
Treatment and Outcomes of Hand Injuries,1,
Virtual Presence and Embodiment in VR Research,1,
Impact of Health Literacy on Health Outcomes,1,
Diagnosis and Treatment of Voice Disorders,1,
Telemedicine in Global Healthcare,1,
Diagnosis and Management of Carpal Tunnel Syndrome,1,
Adaptation of Tendon and Skeletal Muscle to Mechanical Loading,1,
Cardiac Rehabilitation and Cardiovascular Health Interventions,1,
Educational Data Mining and Learning Analytics,1,
Exercise Physiology and Cardiovascular Health,1,
Simulation-based Medical Education and Training Techniques,1,
Interoception and Somatic Symptoms,1,
Neurological Manifestations of COVID-19 Infection,1,
Diagnosis and Treatment of Spinal Infections,1,
Effects of Emotional Intelligence on Performance and Attitude,1,
Mobile Health Interventions and Applications,1,
Incidence and Management of Hip Fractures,1,
Factors Influencing Patient Satisfaction with Healthcare,1,
Surgical Management of Brachial Plexus Injuries,1,
The Role of Optimism in Psychological Well-being,1,
Biochemicals Associated with Myofascial Pain and Inflammation,1,
Cutaneous Manifestations of COVID-19: A Comprehensive Review,1,
Heterotopic Ossification and Fibrodysplasia Ossificans Progressiva,1,
Musculoskeletal Education in Medical Training,1,
Innovation in E-Learning and Knowledge Management,1,
